{"generation_ref":"sha256:ce9293a5ac93441737365a15f88818daafbf3ad3a668b675746728dcd68ba5a1","members":{"classified_source_ledger":{"artifact_ref":"sha256/1d/1d56cfaa3707f0c223757ff0e5e9bf2da4b14005bb1ad28629115b4e42b1f57d.json","value_hash":"sha256:1d56cfaa3707f0c223757ff0e5e9bf2da4b14005bb1ad28629115b4e42b1f57d"},"decoded_source":{"artifact_ref":"sha256/30/301f9791d9dc70e40ed954376996776f019d8bf447a4c328e980c2de1f9f94b9.txt","value_hash":"sha256:301f9791d9dc70e40ed954376996776f019d8bf447a4c328e980c2de1f9f94b9"},"parser_output":{"artifact_ref":"sha256/df/df1310108dabc4e8944d712bc09868a92cd097244fb20db6854746b7b76fa050.json","value_hash":"sha256:df1310108dabc4e8944d712bc09868a92cd097244fb20db6854746b7b76fa050"},"raw_diagnostics":{"artifact_ref":"sha256/18/18d57debc200c41c3114a3d616da83226a15e592e8929092085762c6aa19afb4.json","value_hash":"sha256:18d57debc200c41c3114a3d616da83226a15e592e8929092085762c6aa19afb4"}},"qualification_identity_ref":"sha256:db804ae6162a6dea2b71e04d465c4e8d0ade0ccf5fbf798d4d670b84c9c7ab78","schema_version":"abc/parser-rq-capture-generation/v1","work_id":"sha256:301f9791d9dc70e40ed954376996776f019d8bf447a4c328e980c2de1f9f94b9"}
