{"generation_ref":"sha256:11ab77dc79cde1a95e86f4edb9ea58553ecf8848b40e4235500c203a8b95b592","members":{"classified_source_ledger":{"artifact_ref":"sha256/1f/1f36b331c66a56ccec01b1197fa936526838ad623030b6ee411cae5e380a2449.json","value_hash":"sha256:1f36b331c66a56ccec01b1197fa936526838ad623030b6ee411cae5e380a2449"},"decoded_source":{"artifact_ref":"sha256/52/5276852ac6edac7641fae7492d55ef6d5c6be3e51a8adb288992d969934d5de2.txt","value_hash":"sha256:5276852ac6edac7641fae7492d55ef6d5c6be3e51a8adb288992d969934d5de2"},"parser_output":{"artifact_ref":"sha256/ef/ef74812fbc42af0af997259e3b29ebeca959d322d289c01fba81f031ba24655a.json","value_hash":"sha256:ef74812fbc42af0af997259e3b29ebeca959d322d289c01fba81f031ba24655a"},"raw_diagnostics":{"artifact_ref":"sha256/18/18d57debc200c41c3114a3d616da83226a15e592e8929092085762c6aa19afb4.json","value_hash":"sha256:18d57debc200c41c3114a3d616da83226a15e592e8929092085762c6aa19afb4"}},"qualification_identity_ref":"sha256:c516f78850fa7119ac7e847793f2544a1ef87ce7ee8f529d1d22b09121ef4169","schema_version":"abc/parser-rq-capture-generation/v1","work_id":"sha256:5276852ac6edac7641fae7492d55ef6d5c6be3e51a8adb288992d969934d5de2"}
