{"generation_ref":"sha256:7149d15e5c83d3cf769484e23b3220828aa3575d9ec5ec275529b9da133c87ef","members":{"classified_source_ledger":{"artifact_ref":"sha256/37/370a295930a9f5d3c2f7844c6fcd7b35813475fa0de8fe7f9d5d15f66fc751d8.json","value_hash":"sha256:370a295930a9f5d3c2f7844c6fcd7b35813475fa0de8fe7f9d5d15f66fc751d8"},"decoded_source":{"artifact_ref":"sha256/6b/6b2676d80da84264c9c704f58ab4ba961651f6e4de14d639e54431c44fd5da8e.txt","value_hash":"sha256:6b2676d80da84264c9c704f58ab4ba961651f6e4de14d639e54431c44fd5da8e"},"parser_output":{"artifact_ref":"sha256/bb/bb0f471a262d0f4d1b86a48275f3b22882bc3a72bd543f06640dbfffa01801c0.json","value_hash":"sha256:bb0f471a262d0f4d1b86a48275f3b22882bc3a72bd543f06640dbfffa01801c0"},"raw_diagnostics":{"artifact_ref":"sha256/cb/cbcf478055ab88b7988cb3265af26233f62a1cf05130e9680cbae2072336af3d.json","value_hash":"sha256:cbcf478055ab88b7988cb3265af26233f62a1cf05130e9680cbae2072336af3d"}},"qualification_identity_ref":"sha256:8764ae22817902b81f69511bbd8ade2088897af52b097a49977ada595091375a","schema_version":"abc/parser-rq-capture-generation/v1","work_id":"sha256:6b2676d80da84264c9c704f58ab4ba961651f6e4de14d639e54431c44fd5da8e"}
