{"generation_ref":"sha256:a0620a9a8696edf83720937f31dbe800f9a33f32f8d279c19442602176ab2697","members":{"classified_source_ledger":{"artifact_ref":"sha256/5c/5ccc1cc42720596ce0625c7350a0c9dda9778f583ae6cf0efe714e21a6a82395.json","value_hash":"sha256:5ccc1cc42720596ce0625c7350a0c9dda9778f583ae6cf0efe714e21a6a82395"},"decoded_source":{"artifact_ref":"sha256/6b/6b2676d80da84264c9c704f58ab4ba961651f6e4de14d639e54431c44fd5da8e.txt","value_hash":"sha256:6b2676d80da84264c9c704f58ab4ba961651f6e4de14d639e54431c44fd5da8e"},"parser_output":{"artifact_ref":"sha256/bb/bb0f471a262d0f4d1b86a48275f3b22882bc3a72bd543f06640dbfffa01801c0.json","value_hash":"sha256:bb0f471a262d0f4d1b86a48275f3b22882bc3a72bd543f06640dbfffa01801c0"},"raw_diagnostics":{"artifact_ref":"sha256/cb/cbcf478055ab88b7988cb3265af26233f62a1cf05130e9680cbae2072336af3d.json","value_hash":"sha256:cbcf478055ab88b7988cb3265af26233f62a1cf05130e9680cbae2072336af3d"}},"qualification_identity_ref":"sha256:6ad6a02c2e9e16e53cfe5cda3786142e58a632a1fc35875334a188721e3bb146","schema_version":"abc/parser-rq-capture-generation/v1","work_id":"sha256:6b2676d80da84264c9c704f58ab4ba961651f6e4de14d639e54431c44fd5da8e"}
