{"generation_ref":"sha256:2570219da25b7d4b940163f180cde0fde26a093e36474aba25c0a85a91fdb436","members":{"classified_source_ledger":{"artifact_ref":"sha256/d4/d4fc4b9045169d66afd578ea316319237e9788745142d5ada9cf218b58e15055.json","value_hash":"sha256:d4fc4b9045169d66afd578ea316319237e9788745142d5ada9cf218b58e15055"},"decoded_source":{"artifact_ref":"sha256/30/301f9791d9dc70e40ed954376996776f019d8bf447a4c328e980c2de1f9f94b9.txt","value_hash":"sha256:301f9791d9dc70e40ed954376996776f019d8bf447a4c328e980c2de1f9f94b9"},"parser_output":{"artifact_ref":"sha256/df/df1310108dabc4e8944d712bc09868a92cd097244fb20db6854746b7b76fa050.json","value_hash":"sha256:df1310108dabc4e8944d712bc09868a92cd097244fb20db6854746b7b76fa050"},"raw_diagnostics":{"artifact_ref":"sha256/18/18d57debc200c41c3114a3d616da83226a15e592e8929092085762c6aa19afb4.json","value_hash":"sha256:18d57debc200c41c3114a3d616da83226a15e592e8929092085762c6aa19afb4"}},"qualification_identity_ref":"sha256:6ad6a02c2e9e16e53cfe5cda3786142e58a632a1fc35875334a188721e3bb146","schema_version":"abc/parser-rq-capture-generation/v1","work_id":"sha256:301f9791d9dc70e40ed954376996776f019d8bf447a4c328e980c2de1f9f94b9"}
