{"generation_ref":"sha256:a3b96459b9d46c6568984ae9db4cf4b2880c0405c94cd29f3b277e321f44929c","members":{"classified_source_ledger":{"artifact_ref":"sha256/ec/ec29770bba40e628cfe8572fa78cd6831bb0e42c295366024280f6f6d97be8c8.json","value_hash":"sha256:ec29770bba40e628cfe8572fa78cd6831bb0e42c295366024280f6f6d97be8c8"},"decoded_source":{"artifact_ref":"sha256/6b/6b2676d80da84264c9c704f58ab4ba961651f6e4de14d639e54431c44fd5da8e.txt","value_hash":"sha256:6b2676d80da84264c9c704f58ab4ba961651f6e4de14d639e54431c44fd5da8e"},"parser_output":{"artifact_ref":"sha256/bb/bb0f471a262d0f4d1b86a48275f3b22882bc3a72bd543f06640dbfffa01801c0.json","value_hash":"sha256:bb0f471a262d0f4d1b86a48275f3b22882bc3a72bd543f06640dbfffa01801c0"},"raw_diagnostics":{"artifact_ref":"sha256/cb/cbcf478055ab88b7988cb3265af26233f62a1cf05130e9680cbae2072336af3d.json","value_hash":"sha256:cbcf478055ab88b7988cb3265af26233f62a1cf05130e9680cbae2072336af3d"}},"qualification_identity_ref":"sha256:0bf4a1ca93935ca224b9517053b9e1667bb9d99d970bce1b53e29ecf022b7d95","schema_version":"abc/parser-rq-capture-generation/v1","work_id":"sha256:6b2676d80da84264c9c704f58ab4ba961651f6e4de14d639e54431c44fd5da8e"}
