{"generation_ref":"sha256:b3b64a6c08756caa0ab2fa89dc8e97f4e0bf4b0c9bbb994c3d53c5db90736746","members":{"classified_source_ledger":{"artifact_ref":"sha256/64/64c2b0b4898399e68e1877bbc77be1a06e1ab25eb9736884bbc5dc84235831f3.json","value_hash":"sha256:64c2b0b4898399e68e1877bbc77be1a06e1ab25eb9736884bbc5dc84235831f3"},"decoded_source":{"artifact_ref":"sha256/14/1486e2c65f6f346b55367050911703554bd5134827c9a8ffba24717be61d5239.txt","value_hash":"sha256:1486e2c65f6f346b55367050911703554bd5134827c9a8ffba24717be61d5239"},"parser_output":{"artifact_ref":"sha256/90/905e33efccced1e6c0c73012884909ef9a22cd944484ed9366d6a13226745df1.json","value_hash":"sha256:905e33efccced1e6c0c73012884909ef9a22cd944484ed9366d6a13226745df1"},"raw_diagnostics":{"artifact_ref":"sha256/cb/cbcf478055ab88b7988cb3265af26233f62a1cf05130e9680cbae2072336af3d.json","value_hash":"sha256:cbcf478055ab88b7988cb3265af26233f62a1cf05130e9680cbae2072336af3d"}},"qualification_identity_ref":"sha256:0bf4a1ca93935ca224b9517053b9e1667bb9d99d970bce1b53e29ecf022b7d95","schema_version":"abc/parser-rq-capture-generation/v1","work_id":"sha256:1486e2c65f6f346b55367050911703554bd5134827c9a8ffba24717be61d5239"}
