{"generation_ref":"sha256:fa03c6b6069b09a7698b65e32b6c7d31989b104c2332749b89a4c93a7cb96e10","members":{"classified_source_ledger":{"artifact_ref":"sha256/ca/cafc9223b1e347e030dab1778cbdb373dc340c840edc667cc5dab227b7a10321.json","value_hash":"sha256:cafc9223b1e347e030dab1778cbdb373dc340c840edc667cc5dab227b7a10321"},"decoded_source":{"artifact_ref":"sha256/6b/6b2676d80da84264c9c704f58ab4ba961651f6e4de14d639e54431c44fd5da8e.txt","value_hash":"sha256:6b2676d80da84264c9c704f58ab4ba961651f6e4de14d639e54431c44fd5da8e"},"parser_output":{"artifact_ref":"sha256/08/084efd6775ad6280747df21453065c349e554205303951c6335cb41e9dc02af2.json","value_hash":"sha256:084efd6775ad6280747df21453065c349e554205303951c6335cb41e9dc02af2"},"raw_diagnostics":{"artifact_ref":"sha256/cb/cbcf478055ab88b7988cb3265af26233f62a1cf05130e9680cbae2072336af3d.json","value_hash":"sha256:cbcf478055ab88b7988cb3265af26233f62a1cf05130e9680cbae2072336af3d"}},"qualification_identity_ref":"sha256:6ad6a02c2e9e16e53cfe5cda3786142e58a632a1fc35875334a188721e3bb146","schema_version":"abc/parser-rq-capture-generation/v1","work_id":"sha256:6b2676d80da84264c9c704f58ab4ba961651f6e4de14d639e54431c44fd5da8e"}
