{"generation_ref":"sha256:267d8255b1d114210c9cb833b9cbc9bddb2307368604ab9d6095bf06adbd976e","members":{"classified_source_ledger":{"artifact_ref":"sha256/f2/f24883709fe33ca4bc15239089b3d27ce496a8e2eb6ccd7eb45de5f5005a441e.json","value_hash":"sha256:f24883709fe33ca4bc15239089b3d27ce496a8e2eb6ccd7eb45de5f5005a441e"},"decoded_source":{"artifact_ref":"sha256/94/94db3f579ed91b8da056aaa32225a732060ee0cb922b11ea1e53e0d2a820b66d.txt","value_hash":"sha256:94db3f579ed91b8da056aaa32225a732060ee0cb922b11ea1e53e0d2a820b66d"},"parser_output":{"artifact_ref":"sha256/e7/e7159f74aafe88e787ed91bc2e7641d1a5a864a44f20b7d6ec1e758c0b4030dd.json","value_hash":"sha256:e7159f74aafe88e787ed91bc2e7641d1a5a864a44f20b7d6ec1e758c0b4030dd"},"raw_diagnostics":{"artifact_ref":"sha256/cb/cbcf478055ab88b7988cb3265af26233f62a1cf05130e9680cbae2072336af3d.json","value_hash":"sha256:cbcf478055ab88b7988cb3265af26233f62a1cf05130e9680cbae2072336af3d"}},"qualification_identity_ref":"sha256:8c1716f07a76ecf79109fe922a84878765c8dbae795b94bdff66e354d960d366","schema_version":"abc/parser-rq-capture-generation/v1","work_id":"000003_3"}
