{"generation_ref":"sha256:8c6de4f97eaee9744cfc9356fe47c9bfc28800475d01c4dfe84a67e7d5225801","members":{"classified_source_ledger":{"artifact_ref":"sha256/25/254fbf66fab65770b1b8afe52228d244e7b8ca7630fe8dca8b63520228347183.json","value_hash":"sha256:254fbf66fab65770b1b8afe52228d244e7b8ca7630fe8dca8b63520228347183"},"decoded_source":{"artifact_ref":"sha256/14/1486e2c65f6f346b55367050911703554bd5134827c9a8ffba24717be61d5239.txt","value_hash":"sha256:1486e2c65f6f346b55367050911703554bd5134827c9a8ffba24717be61d5239"},"parser_output":{"artifact_ref":"sha256/bd/bd62490053db888fd0ac82d249328c4c35428ad3540c72231448728c6316acf9.json","value_hash":"sha256:bd62490053db888fd0ac82d249328c4c35428ad3540c72231448728c6316acf9"},"raw_diagnostics":{"artifact_ref":"sha256/cb/cbcf478055ab88b7988cb3265af26233f62a1cf05130e9680cbae2072336af3d.json","value_hash":"sha256:cbcf478055ab88b7988cb3265af26233f62a1cf05130e9680cbae2072336af3d"}},"qualification_identity_ref":"sha256:6ad6a02c2e9e16e53cfe5cda3786142e58a632a1fc35875334a188721e3bb146","schema_version":"abc/parser-rq-capture-generation/v1","work_id":"sha256:1486e2c65f6f346b55367050911703554bd5134827c9a8ffba24717be61d5239"}
