{"generation_ref":"sha256:fb927e78bb44d912ada93e341c301a1cdc30ac041e441b8a734e4e30df40d4ff","members":{"classified_source_ledger":{"artifact_ref":"sha256/5b/5b57d28d54052f81a80d47efa00acde061b84e7b8834f5252fe4a254e1c6412e.json","value_hash":"sha256:5b57d28d54052f81a80d47efa00acde061b84e7b8834f5252fe4a254e1c6412e"},"decoded_source":{"artifact_ref":"sha256/a8/a8ee54c20df86415fa85d88a76fe9d4790cac07134b6cab16f083365e39ede40.txt","value_hash":"sha256:a8ee54c20df86415fa85d88a76fe9d4790cac07134b6cab16f083365e39ede40"},"parser_output":{"artifact_ref":"sha256/ba/bad242670a13cada1ea1eb513b5bb7df06406246961a19aae6b5a8f95ebdd4bb.json","value_hash":"sha256:bad242670a13cada1ea1eb513b5bb7df06406246961a19aae6b5a8f95ebdd4bb"},"raw_diagnostics":{"artifact_ref":"sha256/cb/cbcf478055ab88b7988cb3265af26233f62a1cf05130e9680cbae2072336af3d.json","value_hash":"sha256:cbcf478055ab88b7988cb3265af26233f62a1cf05130e9680cbae2072336af3d"}},"qualification_identity_ref":"sha256:6ad6a02c2e9e16e53cfe5cda3786142e58a632a1fc35875334a188721e3bb146","schema_version":"abc/parser-rq-capture-generation/v1","work_id":"sha256:a8ee54c20df86415fa85d88a76fe9d4790cac07134b6cab16f083365e39ede40"}
