{"generation_ref":"sha256:c3b3f8af49d59a126aa726f4452a5742cc5d41558996383a651ca9affd63e1aa","members":{"classified_source_ledger":{"artifact_ref":"sha256/94/945dd059adcca41a09092de9f364d65de4f2d2ca4f7c08984dcaeb39f56edc95.json","value_hash":"sha256:945dd059adcca41a09092de9f364d65de4f2d2ca4f7c08984dcaeb39f56edc95"},"decoded_source":{"artifact_ref":"sha256/14/1486e2c65f6f346b55367050911703554bd5134827c9a8ffba24717be61d5239.txt","value_hash":"sha256:1486e2c65f6f346b55367050911703554bd5134827c9a8ffba24717be61d5239"},"parser_output":{"artifact_ref":"sha256/90/905e33efccced1e6c0c73012884909ef9a22cd944484ed9366d6a13226745df1.json","value_hash":"sha256:905e33efccced1e6c0c73012884909ef9a22cd944484ed9366d6a13226745df1"},"raw_diagnostics":{"artifact_ref":"sha256/cb/cbcf478055ab88b7988cb3265af26233f62a1cf05130e9680cbae2072336af3d.json","value_hash":"sha256:cbcf478055ab88b7988cb3265af26233f62a1cf05130e9680cbae2072336af3d"}},"qualification_identity_ref":"sha256:8764ae22817902b81f69511bbd8ade2088897af52b097a49977ada595091375a","schema_version":"abc/parser-rq-capture-generation/v1","work_id":"sha256:1486e2c65f6f346b55367050911703554bd5134827c9a8ffba24717be61d5239"}
