{"generation_ref":"sha256:fb9ad0904c392ec534dd870491578232317609eaf38a6ac55786471f1705e956","members":{"classified_source_ledger":{"artifact_ref":"sha256/57/57c7b12859ea815db669ae9c973fcc10f2577d8541450b579e4c6f726479e31a.json","value_hash":"sha256:57c7b12859ea815db669ae9c973fcc10f2577d8541450b579e4c6f726479e31a"},"decoded_source":{"artifact_ref":"sha256/52/5276852ac6edac7641fae7492d55ef6d5c6be3e51a8adb288992d969934d5de2.txt","value_hash":"sha256:5276852ac6edac7641fae7492d55ef6d5c6be3e51a8adb288992d969934d5de2"},"parser_output":{"artifact_ref":"sha256/ef/ef74812fbc42af0af997259e3b29ebeca959d322d289c01fba81f031ba24655a.json","value_hash":"sha256:ef74812fbc42af0af997259e3b29ebeca959d322d289c01fba81f031ba24655a"},"raw_diagnostics":{"artifact_ref":"sha256/18/18d57debc200c41c3114a3d616da83226a15e592e8929092085762c6aa19afb4.json","value_hash":"sha256:18d57debc200c41c3114a3d616da83226a15e592e8929092085762c6aa19afb4"}},"qualification_identity_ref":"sha256:0cdbd4e18072cf0693cbc2626e29d89bd2fa88d3b2f9fb78c1de173cab1164d2","schema_version":"abc/parser-rq-capture-generation/v1","work_id":"sha256:5276852ac6edac7641fae7492d55ef6d5c6be3e51a8adb288992d969934d5de2"}
