{"generation_ref":"sha256:ae483a1b6def82416c69f105fc338975ba49825640a9008fd4edf4af24a84275","members":{"classified_source_ledger":{"artifact_ref":"sha256/82/828f848a820868e9a74d1d0eee4bb33d0d4aadeaeb7b8efef16381db183b91e0.json","value_hash":"sha256:828f848a820868e9a74d1d0eee4bb33d0d4aadeaeb7b8efef16381db183b91e0"},"decoded_source":{"artifact_ref":"sha256/14/1486e2c65f6f346b55367050911703554bd5134827c9a8ffba24717be61d5239.txt","value_hash":"sha256:1486e2c65f6f346b55367050911703554bd5134827c9a8ffba24717be61d5239"},"parser_output":{"artifact_ref":"sha256/90/905e33efccced1e6c0c73012884909ef9a22cd944484ed9366d6a13226745df1.json","value_hash":"sha256:905e33efccced1e6c0c73012884909ef9a22cd944484ed9366d6a13226745df1"},"raw_diagnostics":{"artifact_ref":"sha256/cb/cbcf478055ab88b7988cb3265af26233f62a1cf05130e9680cbae2072336af3d.json","value_hash":"sha256:cbcf478055ab88b7988cb3265af26233f62a1cf05130e9680cbae2072336af3d"}},"qualification_identity_ref":"sha256:c516f78850fa7119ac7e847793f2544a1ef87ce7ee8f529d1d22b09121ef4169","schema_version":"abc/parser-rq-capture-generation/v1","work_id":"sha256:1486e2c65f6f346b55367050911703554bd5134827c9a8ffba24717be61d5239"}
